76,山下出泉 蒙. 君子以果行育德.,산 아래에 샘이 나오는 것이 몽괘의 상이다. 군자를 이 괘상을 본받아 행동을 과감히 하고 덕을 기른다.,初六. 發蒙 利用刑人 用說桎梏 以往吝.,몽매한 사람을 깨우치니 형인을 사용하는 것이 이롭고 형틀에서 벗어나게 하나 가면 어렵다.,九二. 包蒙吉 納婦吉 子克家.,몽매한 사람을 포용하니 길하다. 아들이 부인을 맞아들이니 길하며 아들이 가정을 다스린다.,六三. 勿用取女 見金夫 不有躬 无攸利.,여자에게 장가들지 말라. 돈 있는 남자를 보고 몸이 없으니 이로울 것 없다.,六四. 困蒙 吝.,몽매한 사람이 곤경에 처해 있으니 어렵다.,六五. 童蒙 吉.,어리고 몽매한 사람이니 길하다.,上九. 擊蒙 不利爲寇 利禦寇.,몽매한 사람을 공격하니 도적이 되면 이롭지 않고 도적을 막으면 이롭다.,,
77,兼山 艮 君子以 思不出其位.,겹친 산이 간(艮)이니 군자가 그것을 본받아 생각을 그 지위에서 벗어나게 하지 않는다.,初六 艮其趾. 无咎 利永貞.,그 발꿈치에 그침이라. 허물이 없으니 길이 곧게 함이 이롭다.,六二 艮其腓 不拯 其隨 其心不快.,장딴지에 그침이니 건지지 못하고 따르기 때문에 그 마음이 기껍지 않다.,九三 艮其限 列其夤 厲 薰心.,허리에 그치기에 등뼈를 벌림이니 위태로움이 마음을 태운다.,六四 艮其身 无咎.,그 몸에 그침이니 허물이 없다.,六五 艮其輔 言有序 悔亡.,볼에 그침이라 말이 순서가 있음이니 후회가 없으리라.,上九 敦艮吉.,그침에 도타움이니 길하리라.,,
78,山附於地 剝 上以 厚下 安宅.,산이 땅에 붙어 있는 것이 박(剝)이니 위에서 그것을 본받아 아래를 두텁게 하여 집을 편안하게 한다.,初六 剝牀以足 蔑貞 凶.,평상을 다리에서 깎는 것이니 곧음을 업신여기는 것이다. 흉할 것이다.,六二 剝牀以辨 蔑貞 凶.,평상을 가로댄 나무에서 깎는 것이니 곧음을 업신여기는 것이다. 흉할 것이다.,六三 剝之 无咎.,깎아내도 허물이 없다.,六四 剝牀以膚 凶.,평상을 살갗에서 깎는 것이니 흉하다.,六五 貫魚 以宮人寵 無不利.,물고기를 꿰어 궁인이 총애 받듯이 하면 이롭지 않음이 없다.,上九 碩果不食 君子得輿 小人剝廬.,상구는 큰 열매가 먹히지 않은 것이니 군자는 수레를 얻고 소인은 집을 허물 것이다.,,
81,天地交 泰 后以 財成天地之道 輔相天地之宜 以左右民,천지가 서로 사귀는 것이 태(泰)이니 임금이 그것을 본받아 천지의 도를 마름질하여 이루며 천지의 마땅함을 도와서 백성을 돕는다.,初九 拔茅茹. 以其彙征 吉.,띠 풀의 뿌리를 뽑는다. 그 무리로써 가니 길하다.,九二 包荒 用馮河 不遐遺 朋亡 得尙于中行.,거친 것을 포용해 주고 황하를 맨몸으로 건너는 용맹을 쓰며 멀리 있는 사람을 버리지 않고 붕당을 없애면 중도를 실천하는 사람과 짝을 이룰 수 있을 것이다.,九三 无平不陂 无往不復 艱貞 无咎 勿恤其孚 于食有福.,평평한 것은 기울지 않는 것이 없으며 가서 돌아오지 않는 것은 없으니 어려워도 곧게 하면 허물이 없어서 근심하지 않더라도 미덥기 때문에 먹는데 복이 있다.,六四 翩翩 不富以其鄰 不戒以孚.,훨훨 날아 내려오니 부유하지 않으면서도 이웃과 함께 하여 경계하지 않아도 믿음이 있을 것이다.,六五 帝乙歸妹 以祉元吉.,제을이 여동생을 시집보내니 복이 있고 크게 길할 것이다.,上六 城復于隍 勿用師 自邑告命 貞吝,성이 무너져 해자로 돌아온다. 군대를 쓰지 말고 읍으로부터 명을 고하니 곧더라도 부끄러울 것이다.,,
82,澤上有地臨 君子以 敎思无窮 容保民无疆.,못 위에 땅이 있는 것이 림(臨)이니 군자(君子)가 그것을 본받아 가르치려는 생각이 다함이 없으며 백성을 포용하여 보존함이 끝이 없다.,初九 咸臨 貞 吉.,감동하여 임하니 바르게 하여 길하다.,九二 咸臨 吉 无不利.,감동하여 임하니 길하여 이롭지 않음이 없으리라.,六三 甘臨 无攸利 旣憂之 无咎.,달콤함으로 임하여 이로운 바가 없으니 이미 근심하므로 허물이 없으리라.,六四 至臨 无咎.,지극하게 임하니 허물이 없다.,六五 知臨 大君之宜 吉.,지혜로 임하니 대군(大君)의 마땅함이라서 길하다.,上六 敦臨 吉 无咎.,돈독하게 임하니 길하여 허물이 없다.,,
83,明入地中 明夷 君子以 莅衆 用晦而明.,“밝음이 땅속으로 들어간 것이 명이이니” 군자가 그것을 본받아 군중을 대할 때에는 어둠을 사용하여 밝게 한다.,初九 明夷于飛 垂其翼 君子于行 三日不食 有攸往 主人有言.,명이는 날 때에 날개를 늘어뜨림이며 군자가 떠남에 삼일 동안 먹지 못하고 가는 바가 있음에 주인이 나무라는 말을 한다.,六二 明夷 夷于左股 用拯馬壯 吉.,명이할 때 좌측 다리에 상처를 입으니 돕는 말을 건장한 것으로 쓰면 길하다.,九三 明夷于南狩 得其大首 不可疾貞.,명이한 때에 남쪽으로 사냥하여 큰 머리를 얻으니 급히 곧게 해서는 안 된다.,六四 入于左腹 獲明夷之心 于出門庭.,좌측 배로 들어가서 명이한 마음을 얻어서 대문의 뜰로 나온다.,六五 箕子之明夷 利貞.,기자의 명이이니 곧음이 이롭다.,上六 不明 晦 初登于天 後入于地.,밝지 못하여 어두우니 처음에는 하늘에 오르고 뒤에는 땅으로 들어간다.,,
84,雷在地中 復 先王以 至日閉關 啇旅不行 后不省方.,우레가 땅속에 있음이 복이니 선왕이 그것을 본받아 동짓날에는 관문을 닫아걸어 장사꾼과 여행자들이 다니지 못하게 하고 임금이 사방을 시찰하지 않게 했다.,初九 不遠復 无祗悔 元吉.,멀리 가지 않고 돌아와 후회에 이름이 없으니 크게 길하다.,六二 休復 吉.,아름다운 돌아옴이니 길하다.,六三 頻復 厲无咎.,자주 돌아옴이니 위태롭지만 허물은 없다.,六四 中行 獨復.,가운데를 지나가지만 혼자서 돌아온다.,六五 敦復 无悔.,돌아옴을 돈독히 함이니 후회가 없다.,上六 迷復 凶 有災眚 用行師 終有大敗 以其國君凶 至于十年 不克征.,돌아옴에 혼미하여 흉하니 재앙이 있어 군사를 동원하는 데에 쓰면 마침내 크게 패할 것이고 나라를 다스리면 임금이 흉하여 십년이 될 때까지 가지 못할 것이다.,,
85,地中生木 升 君子以 順德 積小以高大.,땅속에서 나무가 나오는 것이 승(升)이니 군자가 그것을 본받아 덕을 순리대로 하며 작은 것을 쌓아 높고 크게 한다.,初六 允升 大吉.,믿어서 자라나니 크게 길하다.,九二 孚 乃利用禴 无咎.,정성이 있어야 검소한 약(禴)제사로 함이 이로우니 허물이 없다.,九三 升虛邑.,빈 고을에 올라간다.,六四 王用亨于岐山 吉 无咎.,왕이 기산에서 형통하듯이 하면 길하여 허물이 없다.,六五 貞 吉 升階.,바르게 하여야 길하니 계단을 올라가듯이 한다.,上六 冥升 利于不息之貞.,올라가는 것에 어두우니 쉬지 않는 바른 도에 이롭다.,,
86,地中有水 師. 君子以容民畜衆.,땅 가운데 물이 있는 것이 사괘의 상이다. 군자는 이 괘상을 본받아 백성을 포용하여 무리를 기른다.,初六 師出以律 否臧凶.,출병은 기율로써 할 것이니 기율을 지키지 않으면 흉하다.,九二. 在師中吉 无咎 王三錫命.,군대 안에 있으면 길하여 허물이 없으니 왕이 세 번 명령을 내린다.,六三. 師或輿尸 凶.,군대가 혹 시체를 수레에 실으니. 흉하다.,六四. 師左次 无咎.,군대가 왼쪽에 주둔하면 허물이 없다.,六五. 田有禽 利執言 无咎. 長子帥師 弟子輿尸 貞凶.,밭에 새와 짐승이 있으니 잡으면 이롭고 허물이 없다(적이 침입하였으니 토벌해야 한다). 큰아들은 군사를 거느리고 둘째아들은 수레에 시체를 실으니 바르고 흉하다.,上六. 大君有命 開國承家. 小人勿用.,대군의 명이 있어 나라를 받고 고을을 받는다. 소인은 쓰지 말라.,,
87,地中有山 謙 君子以 裒多益寡 稱物平施.,땅 속에 산이 있는 것이 겸(謙)이니 군자가 그것을 본받아 많은 것을 덜어내 적은 데에 더해 주어 물건을 저울질하여 베풂을 고르게 한다.,初六 謙謙君子 用涉大川 吉.,겸손하고 겸손한 군자이니 써 큰 내를 건너더라도 길하다.,六二 鳴謙 貞吉.,겸손함을 울림이니 바르고 길하다.,九三 勞謙 君子有終 吉.,공로가 있으며 겸손함이니 군자가 끝마침이 있으면 길하다.,六四 无不利撝謙.,겸손함을 펼침에 이롭지 않음이 없다.,六五 不富 以其鄰 利用侵伐 无不利.,부유하지 않고도 이웃함이니 침벌을 씀이 이로우니 이롭지 않음이 없으리라.,上六 鳴謙 利用行師 征邑國.,겸손함이 울림이니 군사를 행하여 읍국(邑國)을 정벌함이 이롭다.,,
88,地勢坤 君子以 厚德 載物.,땅의 형세가 곤(坤)이니 군자가 그것을 본받아 후한 덕으로 만물을 실어준다.,初六. 履霜 堅冰至.,서리를 밟으니 굳은 얼음이 언다.,六二. 直方. 大. 不習无不利.,곧고 반듯하다. 크다. 익히지 않아도 이롭지 않음이 없다.,六三. 含章可貞 或從王事 无成有終.,아름다움을 품고 바를 수 있으니 혹왕의 일을 따라도 이루는 것 없이 마친다.,六四. 括囊 无咎无譽.,주머니를 묶으니 허물도 없고 명예도 없다.,六五. 黃裳 元吉.,황색 치마를 입었으니 크게 길하다.,上六. 龍戰于野 其血玄黃.,용이 들에서 싸우니 그 피가 검고 누렇다.,用六. 利永貞.,영원히 바르게 하면 이롭다.